{"run":41,"commit":"8e9a6b0","metric":57.5,"metrics":{"build_s":0.1,"l1_s":1.13,"l2l3_s":56.5},"status":"discard","description":"vitest maxConcurrency=20","timestamp":1776665673686,"segment":4,"confidence":9.621621621621621,"iterationTokens":477,"asi":{"hypothesis":"Bump vitest maxConcurrency 5→20 to allow more parallel its inside concurrent describes","rollback_reason":"Within noise (57.5 vs 55.2 prior). Default maxConcurrency may already be high enough or limited by other factor."}}
{"type":"config","name":"优化 UT 执行效率（src + worker）","metricName":"test_duration_s","metricUnit":"s","bestDirection":"lower"}
{"run":42,"commit":"7a0af3e","metric":1.87,"metrics":{},"status":"keep","description":"Baseline: bun run test:coverage (src 68 files + worker 2 files)","timestamp":1777163199988,"segment":5,"confidence":null,"iterationTokens":252,"asi":{"hypothesis":"Establish baseline for combined src+worker UT coverage","src_only_s":1.28,"worker_only_s":0.23,"src_tests":1308,"worker_tests":96,"potential_wins":["Run src and worker vitest in parallel","Drop coverage instrument overhead","Skip worker startup overhead"]}}
{"run":43,"commit":"bcbd417","metric":1.38,"metrics":{},"status":"keep","description":"Parallelize src + worker vitest via scripts/run-ut-parallel.ts","timestamp":1777163233750,"segment":5,"confidence":null,"iterationTokens":7489,"asi":{"hypothesis":"Run src+worker vitest suites in parallel via Bun script with Promise.all","result":"1.87 -> 1.38 (-26%). Both run concurrently; worker is fast and overlaps with src startup."}}
{"run":44,"commit":"2427da2","metric":1.36,"metrics":{},"status":"keep","description":"Verify: 3 consecutive runs after parallelization","timestamp":1777163252602,"segment":5,"confidence":25.50000000000026,"iterationTokens":1218,"asi":{"hypothesis":"Verify stability of parallelized run","result":"3 runs: 1.36/1.38/1.44, avg 1.39"}}
{"run":45,"commit":"2427da2","metric":1.29,"metrics":{},"status":"keep","description":"vitest pool=threads, isolate=false for src tests","timestamp":1777163269617,"segment":5,"confidence":12.888888888888879,"iterationTokens":943,"asi":{"hypothesis":"Use threads pool with isolate=false for src vitest (lower startup, shared module graph)","result":"1.36 -> 1.29 (-5%). 3 runs 1.29/1.29/1.32. All tests pass; isolate=false is safe because src tests don't mutate globals.","risk":"isolate=false reuses worker globals across files; if a test pollutes module state it could leak. Pre-existing tests appear clean."}}
{"run":46,"commit":"5be7bdd","metric":0.94,"metrics":{},"status":"keep","description":"vitest v4 syntax: pool=threads, top-level isolate=false","timestamp":1777163395807,"segment":5,"confidence":13.285714285714276,"iterationTokens":3697,"asi":{"hypothesis":"Vitest v4: top-level isolate=false + pool=threads (poolOptions deprecated)","result":"1.29 -> 0.94 (-27%). 3 runs 0.94/1.08/0.98. Tests pass; typecheck OK."}}
{"run":47,"commit":"56ffcfd","metric":0.91,"metrics":{},"status":"keep","description":"Coverage reporter text-summary (skip per-file table)","timestamp":1777163429287,"segment":5,"confidence":4.363636363636364,"iterationTokens":2446,"asi":{"hypothesis":"Use text-summary coverage reporter to skip per-file table rendering","result":"0.94 -> 0.91 (3 runs 1.02/0.91/0.91). Marginal but real. Less console noise."}}
{"run":48,"commit":"56ffcfd","metric":0.97,"metrics":{},"status":"discard","description":"maxWorkers=4 limit threads","timestamp":1777163449904,"segment":5,"confidence":2.9999999999999996,"iterationTokens":1254,"asi":{"hypothesis":"maxWorkers=4 reduces worker startup overhead","result":"0.91 -> 1.00. Slower. Default thread count is better here.","rollback_reason":"Slower than default","next_action_hint":"Try other knob"}}
{"run":49,"commit":"56ffcfd","metric":1.46,"metrics":{},"status":"discard","description":"fileParallelism=false","timestamp":1777163467803,"segment":5,"confidence":3.918367346938776,"iterationTokens":1166,"asi":{"hypothesis":"fileParallelism=false single-thread","result":"0.91 -> 1.47. Much slower. Need parallelism.","rollback_reason":"Slower"}}
{"run":50,"commit":"56ffcfd","metric":0.92,"metrics":{},"status":"discard","description":"coverage.skipFull=true","timestamp":1777163513500,"segment":5,"confidence":2.9999999999999996,"iterationTokens":2610,"asi":{"hypothesis":"skipFull on coverage","result":"0.91 -> 0.92, within noise. Marginal at best.","rollback_reason":"No improvement"}}
{"run":51,"commit":"56ffcfd","metric":1.13,"metrics":{},"status":"discard","description":"maxWorkers=2","timestamp":1777163581708,"segment":5,"confidence":3.918367346938776,"iterationTokens":8148,"asi":{"hypothesis":"maxWorkers=2","result":"Slower (1.13)","rollback_reason":"Slower"}}
{"run":52,"commit":"56ffcfd","metric":0.9,"metrics":{},"status":"discard","description":"maxWorkers=8","timestamp":1777163595393,"segment":5,"confidence":4.363636363636367,"iterationTokens":917,"asi":{"hypothesis":"maxWorkers=8 (cap at 8 threads)","result":"0.91 -> 0.90, within noise. No real difference vs default (probably already <=8).","rollback_reason":"No improvement, default works fine; keep config minimal"}}
{"run":53,"commit":"56ffcfd","metric":0.93,"metrics":{},"status":"discard","description":"worker pool=threads isolate=false","timestamp":1777163608134,"segment":5,"confidence":6.6206896551724235,"iterationTokens":1045,"asi":{"hypothesis":"Apply pool=threads, isolate=false to worker vitest","result":"Within noise. Worker overlaps with src so doesn't reduce total wall time.","rollback_reason":"No measurable improvement"}}
{"run":54,"commit":"e399e54","metric":0.89,"metrics":{},"status":"keep","description":"Vitest 4 projects: single-process src + worker run","timestamp":1777163935205,"segment":5,"confidence":12.250000000000007,"iterationTokens":2015,"asi":{"hypothesis":"Use Vitest 4 projects to run src + worker in single process; combined coverage across both","result":"0.91 -> 0.89 (3 runs 0.91/0.89/0.89). Combined 1404 tests. Coverage: lines 99.34%, statements 99%, branches 97.69%, functions 97.6% — all >95%.","side_effects":"removes need for scripts/run-ut-parallel.ts wrapper; single vitest startup vs. parallel of two; coverage now reports both src and worker"}}
{"run":55,"commit":"e399e54","metric":1.01,"metrics":{},"status":"discard","description":"pool=vmThreads","timestamp":1777163982328,"segment":5,"confidence":10.315789473684214,"iterationTokens":1993,"asi":{"hypothesis":"vmThreads instead of threads for src","result":"Slower (1.04 vs 0.89)","rollback_reason":"Slower"}}
{"run":56,"commit":"e399e54","metric":0.94,"metrics":{},"status":"discard","description":"coverage.clean=false","timestamp":1777164012921,"segment":5,"confidence":14.00000000000001,"iterationTokens":1993,"asi":{"hypothesis":"coverage.clean=false to skip output cleanup","result":"Slightly slower (0.94 vs 0.89 best). Within noise but no gain.","rollback_reason":"Doesn't help since text-summary doesn't emit files anyway"}}
{"run":57,"commit":"e399e54","metric":0.89,"metrics":{},"status":"discard","description":"coverage processingConcurrency=16","timestamp":1777164029578,"segment":5,"confidence":16.333333333333336,"iterationTokens":1108,"asi":{"hypothesis":"Increase coverage processingConcurrency to 16","result":"Within noise (0.89-0.97).","rollback_reason":"No clear improvement, default value works fine"}}
{"run":58,"commit":"7ec4a38","metric":0.91,"metrics":{},"status":"keep","description":"Update autoresearch.md with Round 2 summary; final verification","timestamp":1777164061583,"segment":5,"confidence":19.600000000000026,"iterationTokens":2892,"asi":{"hypothesis":"Doc update + final verification (no code change)","result":"Stable 0.89-0.96s, baseline 1.87s, -50% gain durable"}}
{"run":59,"commit":"7ec4a38","metric":0.9,"metrics":{},"status":"discard","description":"deps.optimizer.ssr.enabled=true","timestamp":1777164114321,"segment":5,"confidence":21.777777777777814,"iterationTokens":3790,"asi":{"hypothesis":"Enable Vite SSR deps optimizer (pre-bundle deps to reduce import time)","result":"Within noise (0.90-0.97). No improvement.","rollback_reason":"No measurable gain"}}
{"run":60,"commit":"8fcb55f","metric":0.88,"metrics":{},"status":"keep","description":"Drop globals:true (all tests already import from vitest)","timestamp":1777164140206,"segment":5,"confidence":19.80000000000003,"iterationTokens":1719,"asi":{"hypothesis":"Remove globals=true since all tests already import from vitest","result":"0.89 -> 0.88 (3 runs 0.92/0.92/0.88). Marginal but tests pass without globals."}}
{"run":61,"commit":"8fcb55f","metric":0.93,"metrics":{},"status":"discard","description":"pool=forks","timestamp":1777164162748,"segment":5,"confidence":24.749999999999982,"iterationTokens":1222,"asi":{"hypothesis":"pool=forks for src","result":"Slightly slower than threads","rollback_reason":"Slower"}}
{"run":62,"commit":"92c1441","metric":0.87,"metrics":{},"status":"keep","description":"Remove unused scripts/run-ut-parallel.ts","timestamp":1777164210485,"segment":5,"confidence":24.99999999999998,"iterationTokens":3501,"asi":{"hypothesis":"Remove now-unused scripts/run-ut-parallel.ts; verify nothing breaks","result":"0.87 best (0.94/0.87/0.89). Within noise of 0.88. Cleanup."}}
{"run":63,"commit":"92c1441","metric":0.89,"metrics":{},"status":"discard","description":"reporters=dot","timestamp":1777164242318,"segment":5,"confidence":24.99999999999998,"iterationTokens":2529,"asi":{"hypothesis":"reporter=dot to reduce console rendering overhead","result":"Within noise (0.89-0.93)","rollback_reason":"No measurable gain; default reporter is fine"}}
{"run":64,"commit":"92c1441","metric":0.9,"metrics":{},"status":"discard","description":"optimizeDeps.include","timestamp":1777164275550,"segment":5,"confidence":24.99999999999998,"iterationTokens":2147,"asi":{"hypothesis":"optimizeDeps.include hot deps","result":"Within noise (0.90-0.97)","rollback_reason":"No clear gain"}}
{"run":65,"commit":"861ab02","metric":0.92,"metrics":{},"status":"keep","description":"Stability check (5 runs)","timestamp":1777164300714,"segment":5,"confidence":28.571428571428545,"iterationTokens":682,"asi":{"hypothesis":"Stability check: 5 consecutive runs","result":"0.92-0.96, avg ~0.94. Stable at floor.","next_action_hint":"Diminishing returns; further gains require migrating off vitest or to bun:test which has compatibility risk."}}
{"run":66,"commit":"861ab02","metric":0,"metrics":{},"status":"crash","description":"worker fileParallelism=false (broken)","timestamp":1777164350180,"segment":5,"confidence":28.571428571428545,"iterationTokens":1337,"asi":{"hypothesis":"fileParallelism=false on worker project to reduce thread startup","result":"Tests didn't run at all (0 tests, 0% coverage). fileParallelism in project config conflicts.","rollback_reason":"Broke test execution"}}
{"run":67,"commit":"861ab02","metric":0.92,"metrics":{},"status":"discard","description":"Stability after crash revert","timestamp":1777164379175,"segment":5,"confidence":33.33333333333331,"iterationTokens":1941,"asi":{"hypothesis":"Confirm steady-state after revert","result":"0.92/0.93/0.92 - back to floor"}}
{"run":68,"commit":"8d1db10","metric":0.89,"metrics":{},"status":"keep","description":"Final stability + autoresearch.md update","timestamp":1777164417059,"segment":5,"confidence":33.33333333333331,"iterationTokens":2198,"asi":{"hypothesis":"Final stability + docs update (no code change)","result":"5 runs: 0.90/0.96/0.89/0.89/0.91, best 0.89s, avg 0.91s. Total -52% from baseline."}}
{"run":69,"commit":"8d1db10","metric":0.89,"metrics":{},"status":"discard","description":"empty coverage reporter","timestamp":1777164449179,"segment":5,"confidence":33.33333333333331,"iterationTokens":1207,"asi":{"hypothesis":"Empty coverage reporter array","result":"Same speed (0.89-0.97). But removes visibility into coverage %.","rollback_reason":"No speed gain; lose coverage visibility which is needed to verify >95% constraint"}}
{"run":70,"commit":"8d1db10","metric":0.89,"metrics":{},"status":"discard","description":"processingConcurrency=1","timestamp":1777164480806,"segment":5,"confidence":33.33333333333331,"iterationTokens":3054,"asi":{"hypothesis":"processingConcurrency=1 (less contention)","result":"Within noise (0.89-0.93)","rollback_reason":"No gain"}}
{"run":71,"commit":"8d1db10","metric":0,"metrics":{},"status":"crash","description":"maxWorkers/minWorkers in project (broken)","timestamp":1777164510091,"segment":5,"confidence":33.33333333333331,"iterationTokens":986,"asi":{"hypothesis":"maxWorkers/minWorkers in project config","result":"BROKEN: 0 tests run, 0% coverage. Same issue as fileParallelism in project config — these settings must be top-level not per-project.","rollback_reason":"Tests didn't actually run; only fast because nothing happened"}}
{"run":72,"commit":"8d1db10","metric":0,"metrics":{},"status":"crash","description":"maxWorkers=6 top-level (flaky)","timestamp":1777164548734,"segment":5,"confidence":33.33333333333331,"iterationTokens":3520,"asi":{"hypothesis":"maxWorkers=6 top-level","result":"First run: 6 failed tests! Flaky with reduced workers + isolate=false + concurrent describes likely sharing state.","rollback_reason":"Causes test failures"}}
{"run":73,"commit":"34e44dc","metric":0.9,"metrics":{},"status":"keep","description":"Document gotchas about maxWorkers/fileParallelism in projects","timestamp":1777164591103,"segment":5,"confidence":33.33333333333331,"iterationTokens":3411,"asi":{"hypothesis":"Document gotchas in autoresearch.md (no code change)","result":"Stable 0.90-0.96"}}
{"run":74,"commit":"34e44dc","metric":0.9,"metrics":{},"status":"discard","description":"coverage.allowExternal=true","timestamp":1777164614003,"segment":5,"confidence":39.999999999999964,"iterationTokens":1311,"asi":{"hypothesis":"coverage.allowExternal=true to skip external file filter","result":"Within noise (0.90-0.94)","rollback_reason":"No gain"}}
{"run":75,"commit":"34e44dc","metric":0.91,"metrics":{},"status":"discard","description":"Remove coverage thresholds","timestamp":1777164630908,"segment":5,"confidence":49.99999999999996,"iterationTokens":1071,"asi":{"hypothesis":"Remove coverage thresholds (might skip some computation)","result":"Within noise (0.91-1.05). Plus losing CI guard for 90% floor.","rollback_reason":"No speed gain; loses safety check that prevents coverage regressions"}}
{"run":76,"commit":"34e44dc","metric":1.5,"metrics":{},"status":"discard","description":"istanbul coverage provider","timestamp":1777164657866,"segment":5,"confidence":39.999999999999964,"iterationTokens":1120,"asi":{"hypothesis":"Try istanbul coverage provider","result":"1.5s+ much slower than v8. Removed dep.","rollback_reason":"Slower, v8 is better"}}
{"run":77,"commit":"bbd5b4a","metric":0.94,"metrics":{},"status":"keep","description":"Final stability sweep (5 runs)","timestamp":1777164676951,"segment":5,"confidence":33.33333333333331,"iterationTokens":1079,"asi":{"hypothesis":"Final stability x5","result":"0.94-1.03 (avg ~0.98). Floor solidly reached. -47% from baseline.","next_action_hint":"Plateau. Further gains require migrating off Vitest/Vite (e.g., bun:test) which has compatibility risk. Remaining ~0.5s startup is Vitest's inherent overhead (transform pipeline, worker bootstrap, coverage setup)."}}
{"run":78,"commit":"177b5e1","metric":0.89,"metrics":{},"status":"keep","description":"Resume: confirm current floor (0.89s)","timestamp":1777164729214,"segment":5,"confidence":39.999999999999964,"iterationTokens":4963,"asi":{"hypothesis":"Re-establish current floor after resume","result":"5 runs: 0.89/0.90/0.91/0.94/0.94. Best 0.89s avg ~0.92s, consistent with prior session."}}
{"run":79,"commit":"177b5e1","metric":1.08,"metrics":{},"status":"discard","description":"pool=vmForks","timestamp":1777164773409,"segment":5,"confidence":33.33333333333331,"iterationTokens":2674,"asi":{"hypothesis":"pool=vmForks for src","result":"Slower (1.08 vs 0.89)","rollback_reason":"Slower"}}
{"run":80,"commit":"7e4dab4","metric":0.8,"metrics":{},"status":"keep","description":"Collapse src+worker projects into single vitest config","timestamp":1777164820418,"segment":5,"confidence":42.79999999999996,"iterationTokens":3891,"asi":{"hypothesis":"Collapse src+worker projects into single top-level vitest config (one worker pool of 8 threads instead of two pools of 8). Single env shared.","result":"0.89 -> 0.80 best (3 runs 0.80/0.81/0.84). 1404 tests pass; coverage unchanged: lines 99.34%, branches 97.69%, functions 97.6%, statements 99%.","key_insight":"vitest projects each spawn their own worker pool; collapsing reduces total worker boot overhead by 50%."}}
{"run":81,"commit":"5a53067","metric":0.79,"metrics":{},"status":"keep","description":"maxConcurrency=20","timestamp":1777164840501,"segment":5,"confidence":53.99999999999996,"iterationTokens":1718,"asi":{"hypothesis":"maxConcurrency=20 for concurrent describe blocks","result":"0.80 -> 0.79 (within noise). Slight gain at best."}}
{"run":82,"commit":"5a53067","metric":0,"metrics":{},"status":"crash","description":"maxWorkers=4 (broken)","timestamp":1777164859605,"segment":5,"confidence":53.99999999999996,"iterationTokens":1718,"asi":{"hypothesis":"maxWorkers=4 with single-project (after collapse)","result":"8 tests fail. Same isolate=false + reduced workers state pollution issue.","rollback_reason":"Test failures"}}
{"run":83,"commit":"5a53067","metric":0.77,"metrics":{},"status":"keep","description":"maxWorkers=minWorkers=12 (more parallel import)","timestamp":1777164922811,"segment":5,"confidence":54.99999999999996,"iterationTokens":6023,"asi":{"hypothesis":"maxWorkers/minWorkers=12 to spread import load across more threads (more parallelism)","result":"0.79 -> 0.77 (3 runs 0.82/0.77/0.79). All 1404 tests pass; coverage unchanged. Slight gain.","import_cumulative_s":2.7}}
{"run":84,"commit":"b5aa348","metric":0.77,"metrics":{},"status":"keep","description":"maxWorkers=12 (drop unsupported minWorkers)","timestamp":1777164952287,"segment":5,"confidence":54.99999999999996,"iterationTokens":1893,"asi":{"hypothesis":"maxWorkers=12 only (drop minWorkers - not supported in vitest 4 top-level)","result":"0.80/0.79/0.77 - same gain as before. typecheck passes."}}
{"run":85,"commit":"b5aa348","metric":0.79,"metrics":{},"status":"discard","description":"maxWorkers=16","timestamp":1777164969336,"segment":5,"confidence":44.000000000000064,"iterationTokens":966,"asi":{"hypothesis":"maxWorkers=16","result":"0.79-0.86, slightly worse than 12 (0.77 best). Diminishing returns past 12.","rollback_reason":"12 better"}}
{"run":86,"commit":"b5aa348","metric":0.78,"metrics":{},"status":"discard","description":"maxWorkers=10","timestamp":1777164985121,"segment":5,"confidence":36.66666666666677,"iterationTokens":899,"asi":{"hypothesis":"maxWorkers=10","result":"0.78-0.82. Within noise of 12 (0.77-0.80).","rollback_reason":"12 marginally better"}}
{"run":87,"commit":"b5aa348","metric":0.82,"metrics":{},"status":"discard","description":"optimizeDeps.include hot deps","timestamp":1777165035551,"segment":5,"confidence":36.66666666666671,"iterationTokens":2550,"asi":{"hypothesis":"optimizeDeps.include hot deps","result":"Slightly slower (0.82-0.83 vs 0.77-0.80)","rollback_reason":"No gain (likely vitest doesn't use vite optimizeDeps in test transformPipeline)"}}
{"run":88,"commit":"b5aa348","metric":1.3,"metrics":{},"status":"discard","description":"deps.inline=true","timestamp":1777165053352,"segment":5,"confidence":36.66666666666677,"iterationTokens":1116,"asi":{"hypothesis":"deps.inline=true (force inline transform of all deps)","result":"Much slower (1.3s+); inlining all node_modules adds transform cost.","rollback_reason":"Slower"}}
{"run":89,"commit":"b5aa348","metric":0.79,"metrics":{},"status":"discard","description":"maxWorkers=14","timestamp":1777165100096,"segment":5,"confidence":31.4285714285715,"iterationTokens":3038,"asi":{"hypothesis":"maxWorkers=14","result":"0.79-0.85, slightly worse than 12","rollback_reason":"12 better"}}
{"run":90,"commit":"b5aa348","metric":0.78,"metrics":{},"status":"discard","description":"excludeAfterRemap=true","timestamp":1777165166674,"segment":5,"confidence":27.500000000000053,"iterationTokens":4536,"asi":{"hypothesis":"excludeAfterRemap=true (skip exclude-matching files after remap)","result":"0.78-0.84, within noise of 0.77-0.80","rollback_reason":"No measurable gain"}}
{"run":91,"commit":"b5aa348","metric":0.78,"metrics":{},"status":"discard","description":"explicit cacheDir","timestamp":1777165183271,"segment":5,"confidence":27.500000000000053,"iterationTokens":1155,"asi":{"hypothesis":"Explicit cacheDir (default already same)","result":"Same. No change","rollback_reason":"No gain"}}
{"run":92,"commit":"483ca7e","metric":0.79,"metrics":{},"status":"keep","description":"Stability sweep + autoresearch.md Round 3 doc","timestamp":1777165235194,"segment":5,"confidence":27.500000000000053,"iterationTokens":3595,"asi":{"hypothesis":"Final stability check after Round 3 (collapse projects + maxWorkers=12 + maxConcurrency=20)","result":"5 runs: 0.79-0.85, avg ~0.82s. -56% from baseline. Documentation updated."}}
{"run":93,"commit":"b95004b","metric":0.8,"metrics":{},"status":"keep","description":"Resume: re-confirm floor","timestamp":1777165310984,"segment":5,"confidence":27.500000000000053,"iterationTokens":1705,"asi":{"hypothesis":"Re-establish floor on resume","result":"5 runs: 0.80-0.86, best 0.80s. Floor consistent with prior session."}}
{"run":94,"commit":"b95004b","metric":0.82,"metrics":{},"status":"discard","description":"esbuild target=esnext","timestamp":1777165338418,"segment":5,"confidence":27.500000000000053,"iterationTokens":1599,"asi":{"hypothesis":"esbuild target=esnext to skip downlevel transforms","result":"0.82-0.83 (within noise)","rollback_reason":"No measurable gain"}}
