{"run":95,"commit":"b95004b","metric":0.81,"metrics":{},"status":"discard","description":"server.preTransformRequests=false","timestamp":1777165351926,"segment":5,"confidence":20.000000000000025,"iterationTokens":915,"asi":{"hypothesis":"Disable Vite preTransformRequests","result":"Within noise (0.81-0.90)","rollback_reason":"No measurable gain"}}
{"run":96,"commit":"b95004b","metric":0.81,"metrics":{},"status":"discard","description":"maxWorkers=8 sanity","timestamp":1777165373230,"segment":5,"confidence":15.714285714285726,"iterationTokens":1358,"asi":{"hypothesis":"maxWorkers=8 (default) explicitly","result":"0.81-0.87, slightly worse than 12","rollback_reason":"12 better"}}
{"run":97,"commit":"b95004b","metric":0.86,"metrics":{},"status":"discard","description":"unplugin-swc transformer","timestamp":1777165403692,"segment":5,"confidence":20.000000000000004,"iterationTokens":1263,"asi":{"hypothesis":"Try SWC transformer via unplugin-swc","result":"0.86-0.92, slightly slower than esbuild. SWC overhead dominates over single-file transform speed advantage.","rollback_reason":"Slower; removed deps"}}
{"run":98,"commit":"b95004b","metric":0,"metrics":{},"status":"crash","description":"sequence.concurrent=true (broken)","timestamp":1777165440244,"segment":5,"confidence":20.000000000000004,"iterationTokens":1263,"asi":{"hypothesis":"sequence.concurrent=true (force all tests concurrent)","result":"Many tests fail (mocks shared between concurrent tests in same file).","rollback_reason":"Test failures"}}
{"run":99,"commit":"60a173e","metric":0.81,"metrics":{},"status":"keep","description":"Floor verification","timestamp":1777165457314,"segment":5,"confidence":15.714285714285726,"iterationTokens":3770,"asi":{"hypothesis":"Verify floor unchanged after experiments","result":"5 runs: 0.81-0.90 (best 0.81). Avg 0.85. Floor confirmed."}}
{"run":100,"commit":"60a173e","metric":0.81,"metrics":{},"status":"discard","description":"execArgv --no-warnings","timestamp":1777165485255,"segment":5,"confidence":14.666666666666666,"iterationTokens":1505,"asi":{"hypothesis":"execArgv=['--no-warnings'] for thread workers","result":"Within noise (0.81-0.87)","rollback_reason":"No measurable gain"}}
{"run":101,"commit":"60a173e","metric":0.8,"metrics":{},"status":"discard","description":"Stub next/server alias (no clear win, risk)","timestamp":1777165578535,"segment":5,"confidence":15.714285714285701,"iterationTokens":7370,"asi":{"hypothesis":"Alias next/server to a tiny stub to skip 16MB Next.js loading","result":"0.80-0.97 (avg 0.83). Within noise of floor (0.81 best). Marginal improvement at best.","rollback_reason":"Marginal gain not worth the risk: aliasing next/server globally in tests could mask production behavior differences (NextResponse.json content-type ordering, NextRequest.cookies, etc). Only 3 test files import it; mostly already mocked."}}
{"run":102,"commit":"7d5ade8","metric":0.81,"metrics":{},"status":"keep","description":"Prune ideas backlog","timestamp":1777165650004,"segment":5,"confidence":14.666666666666666,"iterationTokens":6470,"asi":{"hypothesis":"Update ideas backlog with Round 3 outcomes (no code change)","result":"Floor confirmed at ~0.81s. Ideas pruned, gotchas documented."}}
{"run":103,"commit":"7d5ade8","metric":0.82,"metrics":{},"status":"discard","description":"silent=passed-only","timestamp":1777165669375,"segment":5,"confidence":15.714285714285701,"iterationTokens":1118,"asi":{"hypothesis":"silent=passed-only to suppress stdout from passing tests","result":"0.82-0.83 (within noise)","rollback_reason":"No measurable gain"}}
{"run":104,"commit":"7d5ade8","metric":0.82,"metrics":{},"status":"discard","description":"chaiConfig tweaks","timestamp":1777165746350,"segment":5,"confidence":15.714285714285701,"iterationTokens":4674,"asi":{"hypothesis":"chaiConfig.includeStack=false, truncateThreshold lower","result":"Within noise (0.82-0.85)","rollback_reason":"No measurable gain"}}
{"run":105,"commit":"a69f246","metric":0.81,"metrics":{},"status":"keep","description":"Long stability sweep","timestamp":1777165773358,"segment":5,"confidence":15.714285714285701,"iterationTokens":1479,"asi":{"hypothesis":"Long stability sweep (7 runs) on resume","result":"0.81-0.85, median 0.81. Floor solid."}}
{"run":106,"commit":"a69f246","metric":0.81,"metrics":{},"status":"discard","description":"Custom largest-first test sequencer","timestamp":1777165813401,"segment":5,"confidence":14.666666666666666,"iterationTokens":2564,"asi":{"hypothesis":"Custom largest-first test sequencer to schedule heaviest files first (improve worker load balance with isolate=false)","result":"0.81-0.85 (median 0.83). Same as default sequencer.","rollback_reason":"No measurable gain. Default vitest sequencer already balances load adequately on 12 workers / 70 files. Cleanup unused file."}}
{"type":"config","name":"Refactor: reduce file/function complexity while maintaining coverage 95%+","metricName":"files_over_400","metricUnit":"","bestDirection":"lower"}
{"run":107,"commit":"a3d9d97","metric":13,"metrics":{"max_file_lines":869,"excess_lines":2442,"coverage_lines":98.61,"coverage_branches":96.44,"coverage_funcs":96.99,"tests":1318},"status":"keep","description":"Baseline: 13 files over 400 lines, max 869 (post.ts), coverage 98.61%/96.44%/96.99%","timestamp":1778984159536,"segment":6,"confidence":null,"asi":{"hypothesis":"establish baseline for complexity refactoring","files_over_400":["src/data/entities/post.ts (869)","src/components/admin/admin-posts-client.tsx (849)","src/data/analytics.ts (785)","src/components/admin/post-form.tsx (732)","src/components/admin/media-library.tsx (679)","src/components/admin/mcp-tokens-manager.tsx (546)","src/components/admin/backup-page.tsx (524)","src/components/admin/site-identity-form.tsx (471)","src/services/unfurl.ts (468)","src/components/admin/system-monitor-dashboard.tsx (454)","src/components/admin/ai-agents-manager.tsx (452)","src/components/admin/taxonomy-manager.tsx (410)","src/components/admin/ai-agent-form.tsx (403)"]}}
{"run":108,"commit":"2622b01","metric":12,"metrics":{"coverage_branches":96.44,"coverage_funcs":97.05,"coverage_lines":98.59,"excess_lines":1973,"max_file_lines":849,"tests":1318},"status":"keep","description":"Split post.ts (869) into 7 modules + barrel; decompose updatePost","timestamp":1778984319231,"segment":6,"confidence":null,"asi":{"hypothesis":"split post.ts (869 LOC) into 7 cohesive modules (types/cache/queries/mutations/tags/aggregates/search) + barrel re-export. updatePost is now decomposed into 5 helpers (applySimpleFields, applyContentUpdate, applyExcerptUpdate, applyReferenceUpdate, applyPublishedAt) each <30 LOC.","next_target":"admin-posts-client.tsx (849)","files_split":["post-types.ts","post-cache.ts","post-queries.ts","post-mutations.ts","post-tags.ts","post-aggregates.ts","post-search.ts"]}}
{"run":109,"commit":"059c6eb","metric":11,"metrics":{"coverage_branches":96.44,"coverage_funcs":97.05,"coverage_lines":98.59,"excess_lines":1524,"max_file_lines":785,"tests":1318},"status":"keep","description":"Split admin-posts-client.tsx (849) into 6 cohesive component files","timestamp":1778984454964,"segment":6,"confidence":2,"asi":{"hypothesis":"split admin-posts-client.tsx (849) into 6 components: sortable-header, copy-link, pagination, bulk-action-bar, list-view, grid-view + main container. Top-level component now <200 LOC; list-view further decomposed into PostTableHeader/PostRow/PostRowTags/PostRowActions sub-components each <80 LOC.","next_target":"analytics.ts (785)"}}
{"run":110,"commit":"059c6eb","metric":10,"metrics":{"coverage_branches":96.41,"coverage_funcs":97.54,"coverage_lines":98.71,"excess_lines":1139,"max_file_lines":732,"tests":1318},"status":"keep","description":"Split analytics.ts (785) into 6 modules; dedupe search/ai bot detail via shared loader","timestamp":1778985273487,"segment":6,"confidence":3,"asi":{"hypothesis":"split analytics.ts (785) into 6 modules: helpers (time windows/source conditions/gap fills/title resolution), record (ingest), overview (summary queries), human, bot-details (search+ai share loader), other. Extract `loadBotDetail` helper to dedupe search vs ai-bot detail queries; extract `normalizeCounts` + `pct` from overview.","next_target":"post-form.tsx (732)"}}
{"run":111,"commit":"e1cd4c0","metric":9,"metrics":{"coverage_branches":96.41,"coverage_funcs":97.57,"coverage_lines":98.65,"excess_lines":1071,"max_file_lines":732,"tests":1318},"status":"keep","description":"Split unfurl.ts (468) into 6 modules; decompose fetchHtml + extractOgMetadata helpers","timestamp":1778985420378,"segment":6,"confidence":4,"asi":{"hypothesis":"split unfurl.ts (468) into 6 modules: types (UnfurlError), ssrf (validateUrl/resolveAndValidateHostname), fetch (fetchHtml + readBodyWithCap + fetchHopRaw helpers), extract (OG meta + body text + matchMetaContent helper), github (README image + helpers), main barrel. fetchHtml decomposed into readBodyWithCap + fetchHopRaw; extractOgMetadata uses shared matchMetaContent.","next_target":"media-library.tsx (679)"}}
{"run":112,"commit":"e365b37","metric":8,"metrics":{"coverage_branches":96.41,"coverage_funcs":97.57,"coverage_lines":98.65,"excess_lines":792,"max_file_lines":732,"tests":1318},"status":"keep","description":"Split media-library.tsx (679) into 6 modules; extract useMediaUpload hook","timestamp":1778985549058,"segment":6,"confidence":3.3333333333333335,"asi":{"hypothesis":"split media-library.tsx (679) into 6 modules: helpers (FileTypeIcon/buildQuery/hasActiveFilters/formatDate/MediaWithUrl), filter-bar, grid (+ MediaGridCard sub), preview lightbox, upload hook (useMediaUpload), main container. Extracts drag-and-drop into reusable hook.","next_target":"mcp-tokens-manager.tsx (546)"}}
{"run":113,"commit":"ef996c2","metric":7,"metrics":{"coverage_branches":96.41,"coverage_funcs":97.57,"coverage_lines":98.65,"excess_lines":646,"max_file_lines":732,"tests":1318},"status":"keep","description":"Split mcp-tokens-manager.tsx (546) into setup-guide + table + manager","timestamp":1778985653501,"segment":6,"confidence":3,"asi":{"hypothesis":"split mcp-tokens-manager.tsx (546) into 3 modules: setup-guide (CopyButton/CodeBlock/McpSetupGuide ~165 lines), table (McpTokensTable/TokenRow/ScopeCell/formatDate/statusFor ~150 lines), manager (~272 lines). Extracts shared callApi helper for fetch+JSON+errorMsg.","next_target":"backup-page.tsx (524)"}}
{"run":114,"commit":"7af5eba","metric":6,"metrics":{"coverage_branches":96.41,"coverage_funcs":97.57,"coverage_lines":98.65,"excess_lines":522,"max_file_lines":732,"tests":1318},"status":"keep","description":"Split backup-page.tsx (524) into helpers + push-card + pull-card","timestamp":1778985743338,"segment":6,"confidence":3.5,"asi":{"hypothesis":"split backup-page.tsx (524) into 4 modules: helpers (StatusMessage/BackupCopyButton/HistoryRow), pull-card (self-contained with own state), push-card (Push state + PushDetailBox + HistorySection sub-components), main barrel (20 lines).","next_target":"site-identity-form.tsx (471)"}}
{"run":115,"commit":"6772d58","metric":5,"metrics":{"coverage_branches":96.41,"coverage_funcs":97.57,"coverage_lines":98.65,"excess_lines":451,"max_file_lines":732,"tests":1318},"status":"keep","description":"Split site-identity-form.tsx (471) into logo + social + form","timestamp":1778985868852,"segment":6,"confidence":4,"asi":{"hypothesis":"split site-identity-form.tsx (471) into 3 components: site-logo-card (drag-and-drop logo upload + state, ~175 lines), social-links-card (SocialLinkRow + add/remove logic, ~120 lines), site-identity-form (main settings form, ~200 lines). Coverage retained at 98.65%/96.41%.","next_target":"system-monitor-dashboard.tsx (454) or ai-agents-manager.tsx (452)"}}
{"run":116,"commit":"4a096e6","metric":4,"metrics":{"coverage_branches":96.41,"coverage_funcs":97.57,"coverage_lines":98.65,"excess_lines":397,"max_file_lines":732,"tests":1318},"status":"keep","description":"Split system-monitor-dashboard.tsx (454) into helpers + chart + dashboard","timestamp":1778985956825,"segment":6,"confidence":3.6,"asi":{"hypothesis":"split system-monitor-dashboard.tsx (454) into 3 modules: helpers (formatters + StatCard + MemoryRecommendation + LoadingSkeleton + types + CHART_COLORS), chart (MemoryTrendChart with downsample helper), dashboard (~115 lines, fetch + composition).","next_target":"ai-agents-manager.tsx (452)"}}
{"run":117,"commit":"83262a4","metric":3,"metrics":{"coverage_branches":96.41,"coverage_funcs":97.57,"coverage_lines":98.65,"excess_lines":345,"max_file_lines":732,"tests":1318},"status":"keep","description":"Split ai-agents-manager.tsx (452) into helpers + table + manager","timestamp":1778986046742,"segment":6,"confidence":3.3333333333333335,"asi":{"hypothesis":"split ai-agents-manager.tsx (452) into 3 modules: helpers (CopyButton/DeleteAgentDialog/NewAgentModal + AgentWithAvatarUrl type), table (AgentRow + AiAgentsTable), manager (~165 lines, fetch+state+modals). Extracts fetchAgentPrompt helper that dedupes new-agent vs show-prompt fallback logic.","next_target":"taxonomy-manager.tsx (410)"}}
{"run":118,"commit":"cb60370","metric":2,"metrics":{"coverage_branches":96.41,"coverage_funcs":97.57,"coverage_lines":98.65,"excess_lines":335,"max_file_lines":732,"tests":1318},"status":"keep","description":"Split taxonomy-manager.tsx (410) into form + table + manager","timestamp":1778986132724,"segment":6,"confidence":3.6666666666666665,"asi":{"hypothesis":"split taxonomy-manager.tsx (410) into 3 modules: form (TaxonomyForm + TaxonomyFormState type), table (TaxonomyTable + ReorderCell + PostCountCell + ActionsCell sub-components), manager (~225 lines: state + handlers + composition). Form pulled out of inline JSX into reusable component.","next_target":"ai-agent-form.tsx (403)"}}
{"run":119,"commit":"cb60370","metric":1,"metrics":{"coverage_branches":96.41,"coverage_funcs":97.57,"coverage_lines":98.65,"excess_lines":332,"max_file_lines":732,"tests":1318},"status":"keep","description":"Split ai-agent-form.tsx (403) into avatar-uploader + form","timestamp":1778986210142,"segment":6,"confidence":4,"asi":{"hypothesis":"split ai-agent-form.tsx (403) into avatar-uploader + form. Avatar block contains its own upload/delete state — clean extraction. Main form drops to <250 lines. Also extracts buildSaveBody helper.","next_target":"post-form.tsx (732) — the last and most complex one"}}
{"run":120,"commit":"aa5e500","metric":0,"metrics":{"coverage_branches":96.41,"coverage_funcs":97.57,"coverage_lines":98.65,"excess_lines":0,"max_file_lines":369,"tests":1318},"status":"keep","description":"Split post-form.tsx (732) into 5 modules — all files now &lt;400 lines","timestamp":1778986426836,"segment":6,"confidence":4,"asi":{"hypothesis":"split post-form.tsx (732) into 5 modules: reference-fields (~170 lines, fully self-contained URL+unfurl+enhance+clear), content-editor (~110 lines, mobile/desktop preview), fields (Excerpt/Status+Category/PublishDate/Tags/FeaturedImage as small sub-components, ~225 lines), helpers (buildSubmitBody + epoch/local conversions, ~85 lines), main form (~367 lines, state + composition + submit). Extracted useMediaPreload + associateMedia helpers. ZERO files >400 lines now.","milestone":"all files_over_400 eliminated","max_file":"369 (admin-posts-list-view.tsx)"}}
{"run":121,"commit":"996757c","metric":0,"metrics":{"coverage_branches":96.41,"coverage_funcs":97.57,"coverage_lines":98.65,"excess_lines":0,"max_file_lines":392,"tests":1318},"status":"keep","description":"Decompose proxy() and createAuthorPostEntity into smaller helpers","timestamp":1778986725240,"segment":6,"confidence":4,"asi":{"hypothesis":"decompose 2 long non-component functions: (1) createAuthorPostEntity (191 LOC) split into buildAuthorPostDataLayer + 4 static config consts (schemas/hooks/projection/descriptions); (2) proxy() (173 LOC) decomposed into 7 stage functions (httpsRedirect, skipStaticAssets, markdownNegotiation, authGuard, rateLimitGuard, wordpressRedirect, trackAnalyticsAndContinue) using ?? chain composition.","remaining_long_fns_nonjsx":["PUT /api/settings (130)","GET /sitemap.xsl (125)","POST /api/backup/pull (121)"],"next_target":"settings route PUT handler"}}
{"run":122,"commit":"794da63","metric":0,"metrics":{"coverage_branches":96.41,"coverage_funcs":97.57,"coverage_lines":98.65,"excess_lines":0,"max_file_lines":392,"tests":1318},"status":"keep","description":"Decompose PUT /api/settings (130) into parseSettingsBody + validators","timestamp":1778986796959,"segment":6,"confidence":4,"asi":{"hypothesis":"decompose PUT /api/settings (130 LOC) into parseSettingsBody helper + 5 focused validators (postsPerPage / commentsEnabled / fontStyle / socialLinks / assignString) + a config-driven loop over the 6 string fields. PUT handler now <20 LOC.","next_target":"GET /sitemap.xsl (125) and POST /api/backup/pull (121)"}}
{"run":123,"commit":"cce75e4","metric":0,"metrics":{"coverage_branches":96.41,"coverage_funcs":97.57,"coverage_lines":98.65,"excess_lines":0,"max_file_lines":392,"tests":1318},"status":"keep","description":"Decompose remaining non-JSX long functions (sitemap.xsl, backup/pull)","timestamp":1778986931752,"segment":6,"confidence":4,"asi":{"hypothesis":"decompose remaining 2 long non-JSX functions: GET /sitemap.xsl (125) extracted XSL_STYLES const + buildSitemapXsl helper; POST /api/backup/pull (121) extracted buildBackupForm + readErrorBody + fetchBackupHistory helpers. NO non-JSX functions >100 LOC remain.","milestone":"all non-JSX functions ≤100 LOC","tsx_components_remaining":"Many React JSX-heavy components still >100 LOC; JSX bodies legitimately count those lines and splitting further would harm cohesion. Continuing improves diminishing returns."}}
{"run":124,"commit":"9089a6e","metric":0,"metrics":{"coverage_branches":96.57,"coverage_funcs":97.82,"coverage_lines":98.77,"excess_lines":0,"max_file_lines":392,"tests":1321},"status":"keep","description":"Add tests for getProviderConfig (services/ai.ts) — branches +0.16","timestamp":1778987191353,"segment":6,"confidence":4,"asi":{"hypothesis":"add 3 tests for getProviderConfig: custom id returns undefined (line 47 branch), unknown id returns undefined, known id returns provider info. Bumped functions coverage 97.57→97.82, branches 96.41→96.57, lines 98.65→98.77.","tests_added":3,"tests_total":1321,"first_run_flaky":"first attempt failed with 6 cross-file errors but passed on retry — known isolate:false pollution; reproducible after the new test file gets reordered"}}
{"run":125,"commit":"6c505ca","metric":0,"metrics":{"coverage_branches":96.73,"coverage_funcs":97.82,"coverage_lines":98.77,"excess_lines":0,"max_file_lines":392,"tests":1322},"status":"keep","description":"Cover baseURL/sdkType truthy branches in generateExcerpt — branches 96.73","timestamp":1778987326438,"segment":6,"confidence":4,"asi":{"hypothesis":"cover the truthy branches of `...(settings.baseURL ? {...} : {})` and `...(settings.sdkType ? {...} : {})` in generateExcerpt by adding a test that resolves AiSettings with non-empty baseURL+sdkType. branches 96.57→96.73.","tests_total":1322}}
{"run":126,"commit":"898b444","metric":0,"metrics":{"coverage_branches":96.9,"coverage_funcs":97.82,"coverage_lines":98.77,"excess_lines":0,"max_file_lines":392,"tests":1324},"status":"keep","description":"Cover undefined-args branches in author-post dataLayer — branches 96.90","timestamp":1778987414829,"segment":6,"confidence":4,"asi":{"hypothesis":"cover undefined-opts/undefined-args branches in author-post dataLayer (list/getById) introduced by my refactor's `(opts ?? {})` guard. branches 96.73→96.90.","tests_total":1324}}
{"run":127,"commit":"c8cfdfb","metric":0,"metrics":{"coverage_branches":97.06,"coverage_funcs":97.82,"coverage_lines":98.77,"excess_lines":0,"max_file_lines":392,"tests":1325},"status":"keep","description":"Cover baseURL/sdkType in summarizeUnfurl — branches 97.06","timestamp":1778987469057,"segment":6,"confidence":4,"asi":{"hypothesis":"cover baseURL/sdkType truthy branches in summarizeUnfurl (lines 146-147). branches 96.90→97.06.","tests_total":1325}}
{"run":128,"commit":"52c2fa9","metric":0,"metrics":{"coverage_branches":97.06,"coverage_funcs":98.06,"coverage_lines":98.83,"excess_lines":0,"max_file_lines":392,"tests":1327},"status":"keep","description":"Add db.call tests — lines 98.83, funcs 98.06","timestamp":1778987636969,"segment":6,"confidence":4,"asi":{"hypothesis":"add db.call tests covering happy path + error path (DbError). lines 98.77→98.83, funcs 97.82→98.06.","tests_total":1327}}
{"run":129,"commit":"52c2fa9","metric":0,"metrics":{"coverage_branches":97.06,"coverage_funcs":98.3,"coverage_lines":98.83,"excess_lines":0,"max_file_lines":392,"tests":1328},"status":"keep","description":"Cover getAnalyticsDailyTrend row-shaping callback — funcs 98.30","timestamp":1778987724551,"segment":6,"confidence":4,"asi":{"hypothesis":"cover the row-shaping `.map((r) => ({...}))` callback inside getAnalyticsDailyTrend (uncalled when results was empty). funcs 98.06→98.30.","tests_total":1328}}
{"run":130,"commit":"07e51b4","metric":0,"metrics":{"coverage_branches":97.06,"coverage_funcs":98.54,"coverage_lines":98.83,"excess_lines":0,"max_file_lines":392,"tests":1329},"status":"keep","description":"Cover updateLastUsed rejection swallow handler in validateMcpToken","timestamp":1778987830774,"segment":6,"confidence":4,"asi":{"hypothesis":"cover the .catch(() => {}) swallow callback for updateLastUsed fire-and-forget in validateMcpToken (it was uncovered — only happy path tested previously). funcs 98.30→98.54.","tests_total":1329}}
