{"run":131,"commit":"0e28c48","metric":0,"metrics":{"coverage_branches":97.14,"coverage_funcs":98.54,"coverage_lines":98.83,"excess_lines":0,"max_file_lines":392,"tests":1330},"status":"keep","description":"Cover rate-limit sweep partial-expiry branch — branches 97.14","timestamp":1778987922109,"segment":6,"confidence":4,"asi":{"hypothesis":"cover the rate-limit sweep branch where a bucket has partially-expired timestamps but still survives. branches 97.06→97.14.","tests_total":1330}}
{"run":132,"commit":"4f7373b","metric":0,"metrics":{"coverage_branches":97.22,"coverage_funcs":98.54,"coverage_lines":98.83,"excess_lines":0,"max_file_lines":392,"tests":1331},"status":"keep","description":"Cover non-Error DNS rejection branch in resolveAndValidateHostname","timestamp":1778988018170,"segment":6,"confidence":4,"asi":{"hypothesis":"cover the non-Error ternary branch of `err instanceof Error ? err.message : 'DNS resolution failed'` in unfurl-ssrf.ts line 95. branches 97.14→97.22.","tests_total":1331}}
{"run":133,"commit":"e813d8c","metric":0,"metrics":{"coverage_branches":97.3,"coverage_funcs":98.54,"coverage_lines":98.89,"excess_lines":0,"max_file_lines":392,"tests":1332},"status":"keep","description":"Cover memoryHistory circular-buffer trim branch — branches 97.30","timestamp":1778988065634,"segment":6,"confidence":4,"asi":{"hypothesis":"cover instrumentation.ts circular-buffer trim branch (memoryHistory.length > MAX_SAMPLES=2880) by advancing fake timers 2900 ticks. lines 98.83→98.89, branches 97.22→97.30.","tests_total":1332}}
{"run":134,"commit":"e813d8c","metric":0,"metrics":{"coverage_branches":98.28,"coverage_funcs":99.27,"coverage_lines":99.57,"excess_lines":0,"max_file_lines":392,"tests":1346},"status":"keep","description":"Add tests for e2e-local + backup.server — coverage 99.57/98.28/99.27","timestamp":1778988168054,"segment":6,"confidence":4,"asi":{"hypothesis":"test the previously-untested server-only modules instead of excluding them from coverage. Added 14 new tests covering generatePullWebhookKey (UUID format + uniqueness) and isLocalE2EMode / resolveLocalR2Path (env gate combinations + path traversal rejection). lines 98.89→99.57, branches 97.30→98.28, funcs 98.54→99.27.","approach":"honest testing (not exclude-list inflation)","tests_total":1346}}
{"run":135,"commit":"1382b42","metric":0,"metrics":{"coverage_branches":98.45,"coverage_funcs":99.27,"coverage_lines":99.57,"excess_lines":0,"max_file_lines":392,"tests":1348},"status":"keep","description":"Cover orphan-reference auto-clear inner branches in updatePost — branches 98.45","timestamp":1778988404404,"segment":6,"confidence":4,"asi":{"hypothesis":"post-mutations.ts lines 114-116 have 3 inner `if (input.referenceXxx === undefined)` checks that auto-clear orphan reference fields when referenceUrl=null. The existing tests covered the all-undefined case (all branches true) and referenceTitle explicit (one false). Added two tests covering referenceDescription explicit and referenceImage explicit, exercising the remaining `false` branches. branches 98.28→98.45.","tests_total":1348}}
{"run":136,"commit":"3370d15","metric":0,"metrics":{"coverage_branches":98.53,"coverage_funcs":99.27,"coverage_lines":99.69,"excess_lines":0,"max_file_lines":392,"tests":1349},"status":"keep","description":"Cover listPosts aiAgentId filter branch — branches 98.53","timestamp":1778988516279,"segment":6,"confidence":4,"asi":{"hypothesis":"listPosts had no test covering the `if (options.aiAgentId !== undefined)` filter branch (post-queries.ts:28-31). Added one test asserting SQL+params include the ai_agent_id filter. branches 98.45→98.53, lines 99.57→99.69.","tests_total":1349}}
{"run":137,"commit":"e753df8","metric":0,"metrics":{"coverage_branches":98.61,"coverage_funcs":99.27,"coverage_lines":99.69,"excess_lines":0,"max_file_lines":392,"tests":1350},"status":"keep","description":"Cover db.ts non-Error fetch rejection branch — branches 98.61","timestamp":1778988784131,"segment":6,"confidence":4,"asi":{"first_run_flaky":"first attempt failed with 8 cross-file isolation errors; retry passed cleanly (known isolate:false pollution)","hypothesis":"cover db.ts:96 non-Error fetch rejection branch — `err instanceof Error ? err.message : String(err)`. branches 98.53→98.61.","tests_total":1350}}
{"run":138,"commit":"2b8e45d","metric":0,"metrics":{"coverage_branches":98.77,"coverage_funcs":99.27,"coverage_lines":99.69,"excess_lines":0,"max_file_lines":392,"tests":1352},"status":"keep","description":"Cover undefined-args branches for getBySlug+delete in author-post — branches 98.77","timestamp":1778988887927,"segment":6,"confidence":4,"asi":{"hypothesis":"cover author-post.ts lines 96,148 — the `(args ?? {})` undefined branch in getBySlug and delete dataLayer ops. Same pattern as the list/getById test added earlier. branches 98.61→98.77.","tests_total":1352}}
{"run":139,"commit":"8facb8a","metric":0,"metrics":{"coverage_branches":98.93,"coverage_funcs":99.27,"coverage_lines":99.69,"excess_lines":0,"max_file_lines":392,"tests":1354},"status":"keep","description":"Cover ai_agent_id mapping branch in mcp post entity — branches 98.93","timestamp":1778989011555,"segment":6,"confidence":4,"asi":{"hypothesis":"cover mcp/entities/post.ts lines 208, 236 — the `ai_agent_id !== undefined && {aiAgentId: ...}` conditional spreads in mapCreateInput and mapUpdateInput. Added one test per handler that passes ai_agent_id and asserts the camelCase mapping. branches 98.77→98.93.","tests_total":1354}}
{"run":140,"commit":"8facb8a","metric":0,"metrics":{"coverage_branches":98.93,"coverage_funcs":99.27,"coverage_lines":99.69,"excess_lines":0,"max_file_lines":392,"tests":1355},"status":"discard","description":"try WORKER_SECRET-missing test — no metric movement (branch already covered)","timestamp":1778989134072,"segment":6,"confidence":4,"asi":{"hypothesis":"tracking.ts:83 uncov branch — thought it was `if (!workerUrl || !workerSecret)`, added a missing-WORKER_SECRET test. NO metric movement (still 98.93) because v8 collapses both env-missing legs into a single short-circuit branch.","rollback_reason":"no coverage gain, test is fine but redundant for the metric","next_action_hint":"target the singleton cache-hit branch at `if (_trackingDb) return _trackingDb` instead (line 83 is actually that, not the env check)"}}
{"run":141,"commit":"60cd1eb","metric":0,"metrics":{"coverage_branches":99.02,"coverage_funcs":99.27,"coverage_lines":99.69,"excess_lines":0,"max_file_lines":392,"tests":1355},"status":"keep","description":"Cover tracking.ts singleton cache-hit branch — branches 99.02 (>99%)","timestamp":1778989160289,"segment":6,"confidence":4,"asi":{"hypothesis":"tracking.ts:83 = `if (_trackingDb) return _trackingDb;` singleton cache hit branch. Each existing test resets _trackingDb so the truthy branch never fires. Added a test that calls trackPageView twice without reset to exercise the cache hit. branches 98.93→99.02 — crosses 99%.","milestone":"branches >99%","tests_total":1355}}
{"run":142,"commit":"60cd1eb","metric":0,"metrics":{"coverage_branches":99.1,"coverage_funcs":99.27,"coverage_lines":99.69,"excess_lines":0,"max_file_lines":392,"tests":1356},"status":"keep","description":"Cover instrumentation NODE_ENV=development branch — branches 99.10","timestamp":1778989272529,"segment":6,"confidence":4,"asi":{"hypothesis":"cover instrumentation.ts:30 module-load ternary `NODE_ENV === 'development' ? 10_000 : 60_000` truthy branch. Setting NODE_ENV=development before freshModule() import lets the dev branch evaluate. branches 99.02→99.10.","tests_total":1356}}
{"run":143,"commit":"e9c47f8","metric":0,"metrics":{"coverage_branches":99.1,"coverage_funcs":99.27,"coverage_lines":99.69,"excess_lines":0,"max_file_lines":392,"tests":1356},"status":"keep","description":"Cover instrumentation NODE_ENV=development branch (stubEnv) — branches 99.10","timestamp":1778989317170,"segment":6,"confidence":4,"asi":{"hypothesis":"same as previous attempt, but use vi.stubEnv to assign NODE_ENV (Next.js types declare it read-only). branches 99.02→99.10 — same gain, now passes typecheck.","tests_total":1356,"first_attempt_fix":"TS2540 readonly NODE_ENV → use vi.stubEnv + vi.unstubAllEnvs"}}
{"run":144,"commit":"2c26a00","metric":0,"metrics":{"coverage_branches":99.18,"coverage_funcs":99.27,"coverage_lines":99.69,"excess_lines":0,"max_file_lines":392,"tests":1357},"status":"keep","description":"Cover instrumentation register() idempotency guard — branches 99.18","timestamp":1778989412101,"segment":6,"confidence":4,"asi":{"first_run_flaky":"8 cross-file pollution errors on first try; retry clean (known isolate:false flake)","hypothesis":"cover instrumentation.ts:53 `if (collectionInterval || collectionStarted) return` already-running guard by calling register() twice and asserting history length is unchanged on the second call. branches 99.10→99.18.","tests_total":1357}}
{"run":145,"commit":"0e8d258","metric":0,"metrics":{"coverage_branches":99.34,"coverage_funcs":99.27,"coverage_lines":99.69,"excess_lines":0,"max_file_lines":392,"tests":1359},"status":"keep","description":"Cover post-service statusChanged + tagIds/categoryChanged branches — branches 99.34","timestamp":1778989552745,"segment":6,"confidence":4,"asi":{"hypothesis":"cover post-service.ts:158-166 nested branches under `if (statusChanged)`: (1) `if (!tagIds)` falsy = explicit tagIds + status change (avoids double tag refresh); (2) `if (!categoryChanged)` falsy = both category and status change (avoids triple category refresh). Added 2 tests asserting call counts. branches 99.18→99.34.","tests_total":1359}}
{"run":146,"commit":"970c6c1","metric":0,"metrics":{"coverage_branches":99.42,"coverage_funcs":99.27,"coverage_lines":99.69,"excess_lines":0,"max_file_lines":392,"tests":1360},"status":"keep","description":"Cover IPv6 unspecified address (::) branch in validateUrl — branches 99.42","timestamp":1778989639910,"segment":6,"confidence":4,"asi":{"hypothesis":"cover unfurl-ssrf.ts:35 `if (lower === \"::\") return true` IPv6 unspecified-address branch. Added a single test asserting validateUrl rejects http://[::]. branches 99.34→99.42.","tests_total":1360}}
{"run":147,"commit":"ffa95c5","metric":0,"metrics":{"coverage_branches":99.51,"coverage_funcs":99.27,"coverage_lines":99.69,"excess_lines":0,"max_file_lines":392,"tests":1361},"status":"keep","description":"Cover resolveLocalR2Path target===root branch — branches 99.51 (>99.5%)","timestamp":1778989728531,"segment":6,"confidence":4,"asi":{"first_run_flaky":"6 cross-file pollution errors first try; clean on retry","hypothesis":"cover e2e-local.ts:59 escapes-root guard right operand `target !== root` falsy case by passing empty key (resolves exactly to root). branches 99.42→99.51.","tests_total":1361,"milestone":"branches >99.5%"}}
{"run":148,"commit":"6c5ae89","metric":0,"metrics":{"coverage_branches":99.51,"coverage_funcs":99.51,"coverage_lines":99.75,"excess_lines":0,"max_file_lines":392,"tests":1362},"status":"keep","description":"Cover unfurl-github abort-on-timeout callback — funcs 99.51, lines 99.75","timestamp":1778989885105,"segment":6,"confidence":4,"asi":{"hypothesis":"cover the `() => controller.abort()` setTimeout callback in unfurl-github.ts by mocking fetch as a never-resolving promise that rejects on abort signal, then advancing fake timers past README_FETCH_TIMEOUT_MS (5s) twice for main+master branch. funcs 99.27→99.51, lines 99.69→99.75.","tests_total":1362}}
{"run":149,"commit":"f3e056f","metric":0,"metrics":{"coverage_branches":99.51,"coverage_funcs":99.75,"coverage_lines":99.75,"excess_lines":0,"max_file_lines":392,"tests":1363},"status":"keep","description":"Cover unfurl-fetch abort-on-timeout callback — funcs 99.75","timestamp":1778989992825,"segment":6,"confidence":4,"asi":{"hypothesis":"cover the `() => controller.abort()` timeout callback in unfurl-fetch.ts using same fake-timer technique. funcs 99.51→99.75.","tests_total":1363}}
{"run":150,"commit":"db1ccba","metric":0,"metrics":{"coverage_branches":99.51,"coverage_funcs":99.75,"coverage_lines":99.81,"excess_lines":0,"max_file_lines":392,"tests":1364},"status":"keep","description":"Cover markdown.ts OPTIMIZABLE_HOSTS catch branch — lines 99.81","timestamp":1778990170274,"segment":6,"confidence":4,"asi":{"hypothesis":"cover markdown.ts:33 module-load catch in OPTIMIZABLE_HOSTS IIFE by setting R2_PUBLIC_URL to `'::'` (invalid URL string) before fresh import. The catch produces an empty whitelist, so internal-asset images are not Next/image-optimized. lines 99.75→99.81.","tests_total":1364}}
{"run":151,"commit":"8bc81e9","metric":0,"metrics":{"coverage_branches":99.51,"coverage_funcs":99.75,"coverage_lines":99.87,"excess_lines":0,"max_file_lines":392,"tests":1365},"status":"keep","description":"Cover markdown filenameFromUrl catch via out-of-range port — lines 99.87","timestamp":1778990304940,"segment":6,"confidence":4,"asi":{"first_run_flaky":"8 cross-file pollution errors on first try; retry clean","hypothesis":"cover markdown.ts:102 catch in filenameFromUrl by using image URL with out-of-range port 99999. Marked preserves the URL, sanitizeUrl passes it (starts with https://), but `new URL` throws. The catch returns empty filename, image renders with alt=\"\". lines 99.81→99.87.","tests_total":1365}}
{"run":152,"commit":"a038f2d","metric":0,"metrics":{"coverage_branches":99.51,"coverage_funcs":100,"coverage_lines":99.93,"excess_lines":0,"max_file_lines":392,"tests":1366},"status":"keep","description":"Cover analytics-human device map callback — functions 100% across codebase","timestamp":1778990484294,"segment":6,"confidence":4,"asi":{"hypothesis":"cover the devices.results.map shaping callback in getHumanDetail (uncalled when devices results were always empty). funcs 99.75→100, lines 99.87→99.93.","milestone":"functions coverage 100%","tests_total":1366,"metric_parse_glitch":"measure.sh regex doesn't capture '100%' (no decimal) so funcs reported 0; real value is 100. statements 99.94, branches 99.51, lines 99.93"}}
{"run":153,"commit":"e7de38c","metric":0,"metrics":{"coverage_branches":99.59,"coverage_funcs":100,"coverage_lines":100,"excess_lines":0,"max_file_lines":392,"tests":1367},"status":"keep","description":"Cover e2e-local escapes-root throw via degenerate localDir='/' — 100% lines + funcs","timestamp":1778990605143,"segment":6,"confidence":4,"asi":{"insight":"discovered the escapes-root guard IS reachable via degenerate `localDir='/'` — the `root + '/' = '//'` prefix check then rejects every legitimate target like '/foo'. Edge case worth documenting (would block real prod use of '/' as root, but that's a misconfiguration).","hypothesis":"cover e2e-local.ts:59 escapes-root throw using localDir='/'. lines 99.93→100, branches 99.51→99.59.","milestones":"lines 100%, funcs 100%, branches 99.59%","tests_total":1367,"measure_sh_fix":"broadened decimal regex to also match '100' (no decimal point)"}}
{"run":154,"commit":"98c2383","metric":0,"metrics":{"coverage_branches":99.59,"coverage_funcs":100,"coverage_lines":100,"excess_lines":0,"max_file_lines":392,"tests":1367},"status":"keep","description":"Split AiSettingsForm (273 LOC) into provider-card + custom-card + form","timestamp":1778990748088,"segment":6,"confidence":4,"asi":{"hypothesis":"split AiSettingsForm (273 LOC) into 3 components: provider-card (provider + model select), custom-card (base URL + sdkType for custom provider), main form (state + handlers + composition). Form drops to ~167 LOC. Coverage unchanged (component code is in src/components excluded from coverage scope).","remaining_long_components":"PostForm (280), McpTokensManager (242), CommandPalette (237), BackupPushCard (235)","rationale":"branch coverage at 99.59% is at the natural ceiling (remaining gaps are dead defensive guards). Switching focus to JSX-component LOC reduction for testability.","tests_total":1367}}
